{
  "$schema": "https://json-schema.org/draft/2020-12/schema",
  "$id": "https://detent.invalid/schemas/capability-declaration.schema.json",
  "$comment": "draft — see ADR-0015. $id host is a placeholder identifier pending the name screen. Fields client_ref_field and list_queryable implement proposed amendment AM-9 (docs/review-queue.md) as draft fields. Shape changes require an ADR.",
  "title": "Capability declaration",
  "description": "A destination's version-pinned, cited capability declaration (master doc §7.3, §7.5, §7.6): what tier it is, what idempotency it honors, what can be queried, and whether the caller can stamp its own reference into the destination object. client_ref_field and list_queryable determine whether ORPHANED and LOST are even detectable for this destination.",
  "type": "object",
  "properties": {
    "adapter": { "type": "string", "minLength": 1 },
    "destination": {
      "description": "The destination API/product this declaration describes.",
      "type": "string",
      "minLength": 1
    },
    "api_version": {
      "description": "Pinned API version/namespace the declaration was verified against. Contract drift forces a declaration update, retest, and deviation ADR (§7.6).",
      "type": "string",
      "minLength": 1
    },
    "tier": {
      "description": "Capability tier (§7.5): C1 idempotency-keyed, C2 queryable, C3 opaque.",
      "enum": ["C1", "C2", "C3"]
    },
    "idempotency": {
      "type": "object",
      "properties": {
        "supported": { "type": "boolean" },
        "window": {
          "description": "Replay window, e.g. '24h', when supported.",
          "type": "string"
        },
        "replay_semantics": {
          "description": "What a replayed key returns (e.g. cached response incl. errors vs re-execution without side effects).",
          "type": "string"
        }
      },
      "required": ["supported"],
      "additionalProperties": false
    },
    "queryable": {
      "type": "object",
      "properties": {
        "supported": { "type": "boolean" },
        "by": {
          "description": "Keys the status query accepts (e.g. destination_ref, client_ref).",
          "type": "array",
          "items": { "type": "string", "minLength": 1 }
        }
      },
      "required": ["supported"],
      "additionalProperties": false
    },
    "client_ref_field": {
      "description": "Destination field where the caller can stamp its operation reference (strongest reconcile hook), or null if none exists (draft field, AM-9).",
      "type": ["string", "null"]
    },
    "list_queryable": {
      "description": "Whether destination effects can be LISTED in a window (distinct from status-by-id) — determines orphan-sweep feasibility (draft field, AM-9).",
      "type": "boolean"
    },
    "compensation_hook": {
      "description": "Destination-native compensation operation, if any. Compensation is a new intent, never rollback (ADR-007).",
      "type": ["string", "null"]
    },
    "citations": {
      "description": "Primary-source URLs the declaration was verified against (§7.6).",
      "type": "array",
      "minItems": 1,
      "items": { "type": "string", "format": "uri" }
    },
    "evidence_quality": {
      "description": "VF = explicit statement in destination docs; EI = evidence-backed inference (e.g. absence from a complete parameter list) — must be labeled per §7.6.",
      "enum": ["VF", "EI"]
    }
  },
  "required": ["adapter", "destination", "api_version", "tier", "idempotency", "queryable", "client_ref_field", "list_queryable", "citations", "evidence_quality"],
  "additionalProperties": false
}
